  {
  "Acknowledgements": {
    "PublisherConfirms": {
      "type": "individual_sync"
    },
    "ConsumerAcks": {
      "mode": "automatic"
    }
  },
  "Durability": {
    "MessageDurability": "persistent",
    "QueueDurability": "persistent"
  },
  "PrefetchCount": {
    "PerConsumer": 1
  },
  "QueueProperties": {
    "QueueStructure": "quorum",
    "QueueSizeMessages": 10,
    "QueueOverflow": "reject-publish"
  },
  "BindingDurability": "fully_durable",
  "TotalQueues": 1,
  "StreamUseCase": {
    "MaxLength": 2048,
    "MaxSegmentSizeBytes": 4096
  }
}